keyword,search_volume,cpc,competition,keyword_difficulty,intent,local_pack_present,trend
hood cleaning fort lauderdale,10,,HIGH,9,commercial,true,stable
restaurant hood cleaning fort lauderdale,,,MEDIUM,,commercial,true,stable
kitchen exhaust cleaning fort lauderdale,,,MEDIUM,,commercial,true,stable
commercial hood cleaning fort lauderdale,,,MEDIUM,,commercial,true,stable
NFPA 96 cleaning fort lauderdale,,,MEDIUM,,commercial,true,stable
hood cleaning service fort lauderdale,,,MEDIUM,,commercial,true,stable
exhaust hood cleaning fort lauderdale,,,MEDIUM,,commercial,true,stable
vent hood cleaning fort lauderdale,,,MEDIUM,,commercial,true,stable
fort lauderdale hood cleaning pros,,,MEDIUM,,commercial,true,stable
fort lauderdale hood cleaning llc,,,MEDIUM,,commercial,true,stable
fort lauderdale kitchen hood cleaning,,,MEDIUM,,commercial,true,stable
fort lauderdale restaurant hood cleaning,,,MEDIUM,,commercial,true,stable
fort lauderdale commercial hood cleaning,,,MEDIUM,,commercial,true,stable
fort lauderdale exhaust hood cleaning,,,MEDIUM,,commercial,true,stable
fort lauderdale vent hood cleaning,,,MEDIUM,,commercial,true,stable
fort lauderdale hood cleaning experts,,,MEDIUM,,commercial,true,stable
fort lauderdale hood cleaning service,,,MEDIUM,,commercial,true,stable
fort lauderdale hood cleaning company,,,MEDIUM,,commercial,true,stable
fort lauderdale hood cleaning cost,,,MEDIUM,,commercial,true,stable
fort lauderdale hood cleaning near me,,,MEDIUM,,commercial,true,stable
fort lauderdale hood cleaning professionals,,,MEDIUM,,commercial,true,stable
fort lauderdale hood cleaning certified,,,MEDIUM,,commercial,true,stable
