keyword,search_volume,cpc,competition,keyword_difficulty,intent,local_pack_present,trend
hood cleaning boca raton,,,MEDIUM,,commercial,true,stable
restaurant hood cleaning boca raton,,,MEDIUM,,commercial,true,stable
kitchen exhaust cleaning boca raton,,,MEDIUM,,commercial,true,stable
commercial hood cleaning boca raton,,,MEDIUM,,commercial,true,stable
NFPA 96 cleaning boca raton,,,MEDIUM,,commercial,true,stable
hood cleaning service boca raton,,,MEDIUM,,commercial,true,stable
exhaust hood cleaning boca raton,,,MEDIUM,,commercial,true,stable
vent hood cleaning boca raton,,,MEDIUM,,commercial,true,stable
boca raton hood cleaning pros,,,MEDIUM,,commercial,true,stable
boca raton hood cleaning llc,,,MEDIUM,,commercial,true,stable
boca raton kitchen hood cleaning,,,MEDIUM,,commercial,true,stable
boca raton restaurant hood cleaning,,,MEDIUM,,commercial,true,stable
boca raton commercial hood cleaning,,,MEDIUM,,commercial,true,stable
boca raton exhaust hood cleaning,,,MEDIUM,,commercial,true,stable
boca raton vent hood cleaning,,,MEDIUM,,commercial,true,stable
boca raton hood cleaning experts,,,MEDIUM,,commercial,true,stable
boca raton hood cleaning service,,,MEDIUM,,commercial,true,stable
boca raton hood cleaning company,,,MEDIUM,,commercial,true,stable
boca raton hood cleaning cost,,,MEDIUM,,commercial,true,stable
boca raton hood cleaning near me,,,MEDIUM,,commercial,true,stable
boca raton hood cleaning professionals,,,MEDIUM,,commercial,true,stable
boca raton hood cleaning certified,,,MEDIUM,,commercial,true,stable
